id,content,title,publisher,url,publishedAt,symbols,description
fdbfa174-8e2b-3af4-bf8a-a0dff534457c,"{'id': 'fdbfa174-8e2b-3af4-bf8a-a0dff534457c', 'contentType': 'STORY', 'title': 'Why Analysts See the Tech Mahindra Story Evolving With Digital Growth and New Partnerships', 'description': '', 'summary': ""Tech Mahindra's consensus analyst price target remains unchanged at ₹1,570.83, which signals continued confidence in the company's fair value. Despite a marginal uptick in the discount rate, analysts are maintaining their revenue growth projections, underlining a steady outlook for the firm. As the narrative around Tech Mahindra continues to evolve with both risks and opportunities, stay tuned to see how you can keep up with future shifts in analyst sentiment. Stay updated as the Fair Value..."", 'pubDate': '2025-11-01T14:11:52Z', 'displayTime': '2025-11-01T14:11:52Z', 'isHosted': True, 'bypassModal': False, 'previewUrl': None, 'thumbnail': {'originalUrl': 'https://media.zenfs.com/en/simply_wall_st__316/cf3f0369cec0a4d8742d0cfe2fa44bae', 'originalWidth': 1194, 'originalHeight': 432, 'caption': '', 'resolutions': [{'url': 'https://s.yimg.com/uu/api/res/1.2/vAb1AaKiRI2SntuMfxvkIg--~B/aD00MzI7dz0xMTk0O2FwcGlkPXl0YWNoeW9u/https://media.zenfs.com/en/simply_wall_st__316/cf3f0369cec0a4d8742d0cfe2fa44bae', 'width': 1194, 'height': 432, 'tag': 'original'}, {'url': 'https://s.yimg.com/uu/api/res/1.2/poaIeEyjfVd6nP7sf.SYQw--~B/Zmk9c3RyaW07aD0xMjg7dz0xNzA7YXBwaWQ9eXRhY2h5b24-/https://media.zenfs.com/en/simply_wall_st__316/cf3f0369cec0a4d8742d0cfe2fa44bae', 'width': 170, 'height': 128, 'tag': '170x128'}]}, 'provider': {'displayName': 'Simply Wall St.', 'url': 'https://simplywall.st/'}, 'canonicalUrl': {'url': 'https://finance.yahoo.com/news/why-analysts-see-tech-mahindra-141152616.html', 'site': 'finance', 'region': 'US', 'lang': 'en-US'}, 'clickThroughUrl': {'url': 'https://finance.yahoo.com/news/why-analysts-see-tech-mahindra-141152616.html', 'site': 'finance', 'region': 'US', 'lang': 'en-US'}, 'metadata': {'editorsPick': False}, 'finance': {'premiumFinance': {'isPremiumNews': False, 'isPremiumFreeNews': False}}, 'storyline': None}",N/A,N/A,N/A,N/A,N/A,N/A
619f432e-4511-3acf-a300-e2c01751c9ca,"{'id': '619f432e-4511-3acf-a300-e2c01751c9ca', 'contentType': 'STORY', 'title': 'What Factors Are Shaping the Evolving Story for Tech Mahindra?', 'description': '', 'summary': ""Tech Mahindra's stock narrative has recently shifted, driven by a marginal decrease in the consensus analyst price target from ₹1,605 to ₹1,571. This adjustment comes as analysts weigh a slightly higher discount rate along with improved revenue growth forecasts. Stay tuned for insights on how to track further developments and stay ahead of changes in the company's evolving outlook. What Wall Street Has Been Saying Analyst commentary on Tech Mahindra’s stock has been relatively limited in..."", 'pubDate': '2025-10-17T19:13:40Z', 'displayTime': '2025-10-17T19:13:40Z', 'isHosted': True, 'bypassModal': False, 'previewUrl': None, 'thumbnail': {'originalUrl': 'https://media.zenfs.com/en/simply_wall_st__316/cf3f0369cec0a4d8742d0cfe2fa44bae', 'originalWidth': 1194, 'originalHeight': 432, 'caption': '', 'resolutions': [{'url': 'https://s.yimg.com/uu/api/res/1.2/vAb1AaKiRI2SntuMfxvkIg--~B/aD00MzI7dz0xMTk0O2FwcGlkPXl0YWNoeW9u/https://media.zenfs.com/en/simply_wall_st__316/cf3f0369cec0a4d8742d0cfe2fa44bae', 'width': 1194, 'height': 432, 'tag': 'original'}, {'url': 'https://s.yimg.com/uu/api/res/1.2/poaIeEyjfVd6nP7sf.SYQw--~B/Zmk9c3RyaW07aD0xMjg7dz0xNzA7YXBwaWQ9eXRhY2h5b24-/https://media.zenfs.com/en/simply_wall_st__316/cf3f0369cec0a4d8742d0cfe2fa44bae', 'width': 170, 'height': 128, 'tag': '170x128'}]}, 'provider': {'displayName': 'Simply Wall St.', 'url': 'https://simplywall.st/'}, 'canonicalUrl': {'url': 'https://finance.yahoo.com/news/factors-shaping-evolving-story-tech-191340296.html', 'site': 'finance', 'region': 'US', 'lang': 'en-US'}, 'clickThroughUrl': {'url': 'https://finance.yahoo.com/news/factors-shaping-evolving-story-tech-191340296.html', 'site': 'finance', 'region': 'US', 'lang': 'en-US'}, 'metadata': {'editorsPick': False}, 'finance': {'premiumFinance': {'isPremiumNews': False, 'isPremiumFreeNews': False}}, 'storyline': None}",N/A,N/A,N/A,N/A,N/A,N/A
49fa1128-0884-39c4-a59e-b8972a6649a0,"{'id': '49fa1128-0884-39c4-a59e-b8972a6649a0', 'contentType': 'VIDEO', 'title': ""Trump's H-1B visa changes bring 'momentum' to int'l stocks"", 'description': '<p>The Trump administration has announced <a data-i13n=""cpos:1;pos:1"" href=""https://finance.yahoo.com/news/how-trump-alarmed-and-tried-to-calm-ceos-with-his-new-100000-h-1b-visa-fee-142058595.html"">changes to the H-1B visa program</a>, including a $100,000 application fee.</p>\n<p>Innovator Capital Management chief investment strategist Tim Urbanowicz joins Opening Bid to examine what the immigration policy change means for investors, while Yahoo Finance Senior Reporter <a data-i13n=""cpos:2;pos:1"" href=""https://finance.yahoo.com/author/brooke-dipalma/"">Brooke DiPalma</a> outlines the stocks that are under pressure following the news.</p>\n<p>To watch more expert insights and analysis on the latest market action, check out more <a data-i13n=""cpos:3;pos:1"" href=""https://finance.yahoo.com/videos/series/opening-bid/"">Opening Bid</a>.</p>', 'summary': 'The Trump administration has announced changes to the H-1B visa program, including a $100,000 application fee. Innovator Capital Management chief investment strategist Tim Urbanowicz joins Opening Bid to examine what the immigration policy change means for investors, while Yahoo Finance Senior Reporter Brooke DiPalma outlines the stocks that are under pressure following the news. To watch more expert insights and analysis on the latest market action, check out more Opening Bid.', 'pubDate': '2025-09-22T19:00:00Z', 'displayTime': '', 'isHosted': True, 'bypassModal': False, 'previewUrl': None, 'thumbnail': {'originalUrl': 'https://s.yimg.com/os/creatr-uploaded-images/2025-09/fdec2390-97c8-11f0-a2f9-ed62dfca6490', 'originalWidth': 3891, 'originalHeight': 2187, 'caption': '', 'resolutions': [{'url': 'https://s.yimg.com/uu/api/res/1.2/17U0oBPWGlao.1E73mOS6w--~B/aD0yMTg3O3c9Mzg5MTthcHBpZD15dGFjaHlvbg--/https://s.yimg.com/os/creatr-uploaded-images/2025-09/fdec2390-97c8-11f0-a2f9-ed62dfca6490', 'width': 3891, 'height': 2187, 'tag': 'original'}, {'url': 'https://s.yimg.com/uu/api/res/1.2/R_oCBmgJF00Qo0Bi2PJJJg--~B/Zmk9c3RyaW07aD0xMjg7dz0xNzA7YXBwaWQ9eXRhY2h5b24-/https://s.yimg.com/os/creatr-uploaded-images/2025-09/fdec2390-97c8-11f0-a2f9-ed62dfca6490', 'width': 170, 'height': 128, 'tag': '170x128'}]}, 'provider': {'displayName': 'Yahoo Finance Video', 'url': 'https://finance.yahoo.com/'}, 'canonicalUrl': {'url': 'https://finance.yahoo.com/video/trumps-h-1b-visa-changes-173000662.html', 'site': 'finance', 'region': 'US', 'lang': 'en-US'}, 'clickThroughUrl': {'url': 'https://finance.yahoo.com/video/trumps-h-1b-visa-changes-173000662.html', 'site': 'finance', 'region': 'US', 'lang': 'en-US'}, 'metadata': {'editorsPick': False}, 'finance': {'premiumFinance': {'isPremiumNews': False, 'isPremiumFreeNews': False}}, 'storyline': None}",N/A,N/A,N/A,N/A,N/A,N/A
dea06ef9-a249-375b-b753-b031f6c03d70,"{'id': 'dea06ef9-a249-375b-b753-b031f6c03d70', 'contentType': 'STORY', 'title': ""Trump's H-1B visa crackdown upends Indian IT industry's playbook"", 'description': '', 'summary': ""BENGALURU (Reuters) -India's $283 billion information technology sector will have to overhaul its decades-old strategy of rotating skilled talent into U.S. projects following U.S. President Donald Trump's move to impose a $100,000 fee for new H-1B visas from Sunday, according to tech veterans, analysts, lawyers and economists.  The sector, which earns about 57% of its total revenue from the U.S. market, has long gained from U.S. work visa programs and the outsourcing of software and business services -- a contentious issue for many Americans who have lost jobs to cheaper workers in India.  India was by far the largest beneficiary of H-1B visas last year, accounting for 71% of approved beneficiaries, while China was a distant second at 11.7%, according to U.S. government data."", 'pubDate': '2025-09-21T15:05:24Z', 'displayTime': '2025-09-21T15:05:24Z', 'isHosted': True, 'bypassModal': False, 'previewUrl': None, 'thumbnail': {'originalUrl': 'https://media.zenfs.com/en/reuters-finance.com/b5e1466f9faf0924214e6364ca3ade40', 'originalWidth': 800, 'originalHeight': 533, 'caption': 'U.S. President Donald Trump signs executive orders in the Oval Office at the White House in Washington', 'resolutions': [{'url': 'https://s.yimg.com/uu/api/res/1.2/OSsmXBz5UsklGEvPjd0QpA--~B/aD01MzM7dz04MDA7YXBwaWQ9eXRhY2h5b24-/https://media.zenfs.com/en/reuters-finance.com/b5e1466f9faf0924214e6364ca3ade40', 'width': 800, 'height': 533, 'tag': 'original'}, {'url': 'https://s.yimg.com/uu/api/res/1.2/ZFBGi_7_yzVk9kdRMKCQew--~B/Zmk9c3RyaW07aD0xMjg7dz0xNzA7YXBwaWQ9eXRhY2h5b24-/https://media.zenfs.com/en/reuters-finance.com/b5e1466f9faf0924214e6364ca3ade40', 'width': 170, 'height': 128, 'tag': '170x128'}]}, 'provider': {'displayName': 'Reuters', 'url': 'http://www.reuters.com/'}, 'canonicalUrl': {'url': 'https://finance.yahoo.com/news/trumps-h-1b-visa-crackdown-150524963.html', 'site': 'finance', 'region': 'US', 'lang': 'en-US'}, 'clickThroughUrl': {'url': 'https://finance.yahoo.com/news/trumps-h-1b-visa-crackdown-150524963.html', 'site': 'finance', 'region': 'US', 'lang': 'en-US'}, 'metadata': {'editorsPick': False}, 'finance': {'premiumFinance': {'isPremiumNews': False, 'isPremiumFreeNews': False}}, 'storyline': None}",N/A,N/A,N/A,N/A,N/A,N/A
4ae81375-5ee9-336e-8042-83800a1be995,"{'id': '4ae81375-5ee9-336e-8042-83800a1be995', 'contentType': 'STORY', 'title': ""India's Tech Mahindra misses fourth-quarter revenue view (April 24)"", 'description': '', 'summary': ""Indian software services exporter Tech Mahindra reported a smaller-than-expected fourth-quarter revenue on Thursday as weakness in communications and hi-tech verticals continued to drag the company's revenues. Consolidated revenue rose 4% to 133.84 billion rupees ($1.57 billion) year-on-year in the quarter ended March 31. Analysts, on average, expected revenue to come in at 134.52 billion rupees, as per data compiled by LSEG."", 'pubDate': '2025-04-24T11:36:49Z', 'displayTime': '2025-04-24T11:36:49Z', 'isHosted': True, 'bypassModal': False, 'previewUrl': None, 'thumbnail': {'originalUrl': 'https://media.zenfs.com/en/reuters.com/2d1e0bc7c3e43888c582ada5a723792b', 'originalWidth': 800, 'originalHeight': 520, 'caption': 'Tech Mahindra quarterly results in Bengaluru', 'resolutions': [{'url': 'https://s.yimg.com/uu/api/res/1.2/eujCTKFPgU4FBP6bdMao0g--~B/aD01MjA7dz04MDA7YXBwaWQ9eXRhY2h5b24-/https://media.zenfs.com/en/reuters.com/2d1e0bc7c3e43888c582ada5a723792b', 'width': 800, 'height': 520, 'tag': 'original'}, {'url': 'https://s.yimg.com/uu/api/res/1.2/USt1uePYKdUKvgaYIsyhyQ--~B/Zmk9c3RyaW07aD0xMjg7dz0xNzA7YXBwaWQ9eXRhY2h5b24-/https://media.zenfs.com/en/reuters.com/2d1e0bc7c3e43888c582ada5a723792b', 'width': 170, 'height': 128, 'tag': '170x128'}]}, 'provider': {'displayName': 'Reuters', 'url': 'https://www.reuters.com/'}, 'canonicalUrl': {'url': 'https://finance.yahoo.com/news/indias-tech-mahindra-misses-first-113649807.html', 'site': 'finance', 'region': 'US', 'lang': 'en-US'}, 'clickThroughUrl': {'url': 'https://finance.yahoo.com/news/indias-tech-mahindra-misses-first-113649807.html', 'site': 'finance', 'region': 'US', 'lang': 'en-US'}, 'metadata': {'editorsPick': False}, 'finance': {'premiumFinance': {'isPremiumNews': False, 'isPremiumFreeNews': False}}, 'storyline': None}",N/A,N/A,N/A,N/A,N/A,N/A
772424fe-b133-3e10-97f9-a8dbf7854d16,"{'id': '772424fe-b133-3e10-97f9-a8dbf7854d16', 'contentType': 'STORY', 'title': 'Tech Mahindra Ltd (BOM:532755) Q3 2025 Earnings Call Highlights: Strong Deal Wins and Margin ...', 'description': '', 'summary': 'Tech Mahindra Ltd (BOM:532755) reports robust new deal wins and improved margins, despite facing currency headwinds and sector-specific challenges.', 'pubDate': '2025-01-18T07:00:25Z', 'displayTime': '2025-01-18T07:00:25Z', 'isHosted': True, 'bypassModal': False, 'previewUrl': None, 'thumbnail': None, 'provider': {'displayName': 'GuruFocus.com', 'url': 'http://www.gurufocus.com/'}, 'canonicalUrl': {'url': 'https://finance.yahoo.com/news/tech-mahindra-ltd-bom-532755-070025170.html', 'site': 'finance', 'region': 'US', 'lang': 'en-US'}, 'clickThroughUrl': {'url': 'https://finance.yahoo.com/news/tech-mahindra-ltd-bom-532755-070025170.html', 'site': 'finance', 'region': 'US', 'lang': 'en-US'}, 'metadata': {'editorsPick': False}, 'finance': {'premiumFinance': {'isPremiumNews': False, 'isPremiumFreeNews': False}}, 'storyline': None}",N/A,N/A,N/A,N/A,N/A,N/A
c0afe8ef-5df7-35f8-b993-560ba83a06e8,"{'id': 'c0afe8ef-5df7-35f8-b993-560ba83a06e8', 'contentType': 'STORY', 'title': ""India's Tech Mahindra bets on 2025 after weak telecom segment weighs on Q3"", 'description': '', 'summary': ""MUMBAI/BENGALURU (Reuters) -Indian software services provider Tech Mahindra's chief executive expects 2025 to be better than last year, after subdued demand in its mainstay telecom segment led to an earnings miss in the third quarter.  Companies in the $245-billion Indian IT sector have been grappling with clients cutting back on discretionary spending for several quarters amid uncertainties in the economy and higher borrowing costs.  CEO Mohit Joshi said much of the sector's revenue is dependent on the macroeconomic situation and overall enterprise expenditures, which in the last six months, have not significantly changed."", 'pubDate': '2025-01-17T10:22:55Z', 'displayTime': '2025-01-17T14:50:16Z', 'isHosted': True, 'bypassModal': False, 'previewUrl': None, 'thumbnail': {'originalUrl': 'https://media.zenfs.com/en/reuters.com/4d8ccd3fe698b4d9e09299fc57af3048', 'originalWidth': 800, 'originalHeight': 569, 'caption': 'FILE PHOTO: Tech Mahindra logo is seen on its office building in Noida', 'resolutions': [{'url': 'https://s.yimg.com/uu/api/res/1.2/6rcS_3SgSzXf5k_HLh5mig--~B/aD01Njk7dz04MDA7YXBwaWQ9eXRhY2h5b24-/https://media.zenfs.com/en/reuters.com/4d8ccd3fe698b4d9e09299fc57af3048', 'width': 800, 'height': 569, 'tag': 'original'}, {'url': 'https://s.yimg.com/uu/api/res/1.2/oWT6pKe2i.1Q4sIGafbBoQ--~B/Zmk9c3RyaW07aD0xMjg7dz0xNzA7YXBwaWQ9eXRhY2h5b24-/https://media.zenfs.com/en/reuters.com/4d8ccd3fe698b4d9e09299fc57af3048', 'width': 170, 'height': 128, 'tag': '170x128'}]}, 'provider': {'displayName': 'Reuters', 'url': 'https://www.reuters.com/'}, 'canonicalUrl': {'url': 'https://finance.yahoo.com/news/indias-tech-mahindra-misses-q3-102255181.html', 'site': 'finance', 'region': 'US', 'lang': 'en-US'}, 'clickThroughUrl': {'url': 'https://finance.yahoo.com/news/indias-tech-mahindra-misses-q3-102255181.html', 'site': 'finance', 'region': 'US', 'lang': 'en-US'}, 'metadata': {'editorsPick': False}, 'finance': {'premiumFinance': {'isPremiumNews': False, 'isPremiumFreeNews': False}}, 'storyline': None}",N/A,N/A,N/A,N/A,N/A,N/A
e3498efd-b8a5-3bce-b8eb-7cd37a17a163,"{'id': 'e3498efd-b8a5-3bce-b8eb-7cd37a17a163', 'contentType': 'STORY', 'title': ""India's Tech Mahindra aiming for bigger bite of bank tech spends, CEO says"", 'description': '', 'summary': ""India's Tech Mahindra is stepping up focus on its banking, financial services and insurance (BFSI) business in a bid to bridge the gap with larger peers which have historically made more revenue from the lucrative segment, its CEO said in an interview.  Mohit Joshi, who took the helm of India's No.5 software services exporter in December 2023 after more than two decades at Infosys, wants to increase the share of BFSI in Tech Mahindra's revenue mix by up to 25% by March 2027, from about 16% currently.  Some of Tech Mahindra's peers in the $254 billion Indian IT sector already make as much as a third of their revenue from this sector."", 'pubDate': '2024-12-19T18:33:18Z', 'displayTime': '2024-12-19T18:33:18Z', 'isHosted': True, 'bypassModal': False, 'previewUrl': None, 'thumbnail': {'originalUrl': 'https://media.zenfs.com/en/reuters.com/36e86b3bde7fb8d3f991170ff52c3419', 'originalWidth': 800, 'originalHeight': 534, 'caption': 'FILE PHOTO: Tech Mahindra quarterly results in Bengaluru', 'resolutions': [{'url': 'https://s.yimg.com/uu/api/res/1.2/.JrbJSQCjOZPxfe_Rn2eqQ--~B/aD01MzQ7dz04MDA7YXBwaWQ9eXRhY2h5b24-/https://media.zenfs.com/en/reuters.com/36e86b3bde7fb8d3f991170ff52c3419', 'width': 800, 'height': 534, 'tag': 'original'}, {'url': 'https://s.yimg.com/uu/api/res/1.2/62eVK4f8B_Db9rWTR_OyhA--~B/Zmk9c3RyaW07aD0xMjg7dz0xNzA7YXBwaWQ9eXRhY2h5b24-/https://media.zenfs.com/en/reuters.com/36e86b3bde7fb8d3f991170ff52c3419', 'width': 170, 'height': 128, 'tag': '170x128'}]}, 'provider': {'displayName': 'Reuters', 'url': 'https://www.reuters.com/'}, 'canonicalUrl': {'url': 'https://finance.yahoo.com/news/indias-tech-mahindra-aiming-bigger-183318918.html', 'site': 'finance', 'region': 'US', 'lang': 'en-US'}, 'clickThroughUrl': {'url': 'https://finance.yahoo.com/news/indias-tech-mahindra-aiming-bigger-183318918.html', 'site': 'finance', 'region': 'US', 'lang': 'en-US'}, 'metadata': {'editorsPick': False}, 'finance': {'premiumFinance': {'isPremiumNews': False, 'isPremiumFreeNews': False}}, 'storyline': None}",N/A,N/A,N/A,N/A,N/A,N/A
7315f72a-20f3-3973-bb18-d3860f14ea64,"{'id': '7315f72a-20f3-3973-bb18-d3860f14ea64', 'contentType': 'STORY', 'title': 'Amazon.com, Inc. (AMZN): Tech Mahindra Partners with AWS to Develop AI-Driven Autonomous Networks Platform for CSPs', 'description': '', 'summary': 'We recently compiled a list of the 15 Trending AI Stocks on Latest Ratings and News. In this article, we are going to take a look at where Amazon.com, Inc. (NASDAQ:AMZN) stands against the other AI stocks. Latest reports indicate that billionaire Masayoshi Son, the founder of Japanese multinational tech firm Softbank, is set to meet […]', 'pubDate': '2024-11-28T19:53:22Z', 'displayTime': '2024-11-28T19:53:22Z', 'isHosted': True, 'bypassModal': False, 'previewUrl': None, 'thumbnail': {'originalUrl': 'https://media.zenfs.com/en/insidermonkey.com/226ed9ed0936942adb97f3d56073e411', 'originalWidth': 1456, 'originalHeight': 816, 'caption': '', 'resolutions': [{'url': 'https://s.yimg.com/uu/api/res/1.2/pPqnw_f5ocAlq67trfHI3Q--~B/aD04MTY7dz0xNDU2O2FwcGlkPXl0YWNoeW9u/https://media.zenfs.com/en/insidermonkey.com/226ed9ed0936942adb97f3d56073e411', 'width': 1456, 'height': 816, 'tag': 'original'}, {'url': 'https://s.yimg.com/uu/api/res/1.2/qxnvWDd15MbgM4XbEkrxZw--~B/Zmk9c3RyaW07aD0xMjg7dz0xNzA7YXBwaWQ9eXRhY2h5b24-/https://media.zenfs.com/en/insidermonkey.com/226ed9ed0936942adb97f3d56073e411', 'width': 170, 'height': 128, 'tag': '170x128'}]}, 'provider': {'displayName': 'Insider Monkey', 'url': 'http://www.insidermonkey.com'}, 'canonicalUrl': {'url': 'https://finance.yahoo.com/news/amazon-com-inc-amzn-tech-195322640.html', 'site': 'finance', 'region': 'US', 'lang': 'en-US'}, 'clickThroughUrl': {'url': 'https://finance.yahoo.com/news/amazon-com-inc-amzn-tech-195322640.html', 'site': 'finance', 'region': 'US', 'lang': 'en-US'}, 'metadata': {'editorsPick': False}, 'finance': {'premiumFinance': {'isPremiumNews': False, 'isPremiumFreeNews': False}}, 'storyline': None}",N/A,N/A,N/A,N/A,N/A,N/A
